SessionTime,SessionTitle,Room,Chair,join_key
"Fri, Aug 1 08:30–12:15",Registration Desk Open,???,Y,
"Fri, Aug 1 09:00–10:30",Track A: Forward and Inverse Problems for Stochastic Reaction Networks,HH Auditorium,,forward and inverse problems for stochastic reaction networks
"Fri, Aug 1 09:00–10:30","Track B: Hardware or Software for (Quasi-)Monte Carlo Algorithms, Part II",HH Ballroom,,hardware or software for quasi monte carlo algorithms part ii
"Fri, Aug 1 09:00–10:30",Track C: Technical Session 3 - Simulation,PH Auditorium,,technical session 3
"Fri, Aug 1 09:00–10:30",Track D: Technical Session 9 - Sampling,WH Auditorium,,technical session 9
"Fri, Aug 1 09:00–10:30",Track E: Technical Session 14 - Markov Chain Monte Carlo,HH Alumni Lounge,,technical session 14
"Fri, Aug 1 10:30-11",Coffee Break,HH Lobby,,
"Fri, Aug 1 11:00-12:00","Plenary Talk by Veronika Ročková, U of Chicago, AI-Powered Bayesian Inference",HH Auditorium,Art Owen,veronika ročková
"Fri, Aug 1 12:00-12:15",Closing Remarks,,,
