André-Alexander,Zepernick,Free University of Berlin,Domain UQ for stationary and time-dependent PDEs using QMC,https://drive.google.com/open?id=1H3jZES353mEI3ouEZgMRZqCxAecuyNOc,Domain Uncertainty Quantification,Yes
Peng,Zhang,Rutgers University,Improving the Design of Randomized Experiments via Discrepancy Theory,https://drive.google.com/open?id=17EuslxRMtJT4hLg2_b2zJnB5Gg8dlYmq,Recent Progress on Algorithmic Discrepancy Theory and Applications,Yes
Chenyang,Zhong,"Department of Statistics, Columbia University",A hit and run approach for sampling and analyzing ranking models,https://drive.google.com/open?id=1W8rDNLmZY_vDD4PryE8pkyr7m9bLJ_-f,"Frontiers in (Quasi-)Monte Carlo and Markov Chain Monte Carlo Methods, Part II",Yes
Nikolaos,Makras,University of Edinburgh,Taming the Interacting Particle Langevin Algorithm – The Superlinear Case,https://drive.google.com/open?id=1G-TnAMYFwLxVgInb1-cyclHQwtHoPmh0,"Stochastic Computation and Complexity, Part V",Yes
Iosif,Lytras,Archimedes/Athena Research Centre,Sampling with Langevin Dynamics from non-smooth and non-logconcave potentials.,https://drive.google.com/open?id=1RBhG0_1hmFD_WkP4n1MDdTF_fG24q3SR,"Stochastic Computation and Complexity, Part V",Yes
Fuzhong,Zhou,Columbia University,Entropy methods for the delocalization of bias in Langevin Monte Carlo,https://drive.google.com/open?id=1445agTSvpVAX8kAPG0mvMfwuiGB4m1QD,"Analysis of Langevin and Related Sampling Algorithms, Part II.",Yes
